data/results/reference/intel/kruskal_wallis.csv

operation,metric,unit,df,H,epsilon_squared,p_value,p_holm,alpha,significant
create-owner-populated,execution_time,ms,2,19.8753753753754,0.5678678678678685,4.831890395295983e-05,0.0004831890395295983,0.05,True
create-owner-populated,cpu_energy,J,2,25.100600600600615,0.7171600171600175,3.5438377768334106e-06,9.92274577513355e-05,0.05,True
create-owner-populated,memory_energy,J,2,20.226726726726724,0.5779064779064779,4.0534245900410536e-05,0.00044852874161222553,0.05,True
create-pet-populated,execution_time,ms,2,27.001501501501508,0.7714714714714717,1.3699302240786285e-06,4.520769739459474e-05,0.05,True
create-pet-populated,cpu_energy,J,2,19.382882882882882,0.5537966537966538,6.181024432624349e-05,0.0005562921989361914,0.05,True
create-pet-populated,memory_energy,J,2,25.351351351351354,0.7243243243243244,3.1262521229711468e-06,9.691381581210555e-05,0.05,True
delete-owner-visits-no-pets,execution_time,ms,2,27.986486486486484,0.7996138996138995,8.371661804246519e-07,3.0137982495287465e-05,0.05,True
delete-owner-visits-no-pets,cpu_energy,J,2,23.301801801801815,0.6657657657657662,8.711200897372577e-06,0.00017008686412005487,0.05,True
delete-owner-visits-no-pets,memory_energy,J,2,27.52702702702703,0.7864864864864867,1.0533726292140883e-06,3.5814669393279e-05,0.05,True
delete-owner-visits-no-visits,execution_time,ms,2,23.64564564564563,0.6755898755898752,7.3352224265860455e-06,0.00016871011581147903,0.05,True
delete-owner-visits-no-visits,cpu_energy,J,2,23.929429429429433,0.6836979836979838,6.364882956619943e-06,0.00015912207391549857,0.05,True
delete-owner-visits-no-visits,memory_energy,J,2,23.351351351351354,0.6671814671814673,8.498034337053976e-06,0.00017008686412005487,0.05,True
delete-owner-visits-populated,execution_time,ms,2,5.073573573573583,0.14495924495924523,0.07912022192248713,0.07912022192248713,0.05,False
delete-owner-visits-populated,cpu_energy,J,2,9.866366366366364,0.2818961818961818,0.007203536570674424,0.021610609712023273,0.05,True
delete-owner-visits-populated,memory_energy,J,2,10.599099099099092,0.30283140283140264,0.0049938428791213105,0.019975371516485242,0.05,True
delete-visit-populated,execution_time,ms,2,7.429429429429419,0.21226941226941198,0.024362390355201432,0.048724780710402864,0.05,True
delete-visit-populated,cpu_energy,J,2,13.3888888888889,0.38253968253968285,0.0012377693329126882,0.006188846664563441,0.05,True
delete-visit-populated,memory_energy,J,2,16.600600600600615,0.4743028743028747,0.0002484422086346757,0.00173909546044273,0.05,True
read-owner-no-pets,execution_time,ms,2,23.424924924924937,0.6692835692835697,8.191099152395794e-06,0.00017008686412005487,0.05,True
read-owner-no-pets,cpu_energy,J,2,23.405405405405418,0.668725868725869,8.271433697548167e-06,0.00017008686412005487,0.05,True
read-owner-no-pets,memory_energy,J,2,25.0870870870871,0.7167739167739171,3.567863703943461e-06,9.92274577513355e-05,0.05,True
read-owner-no-visits,execution_time,ms,2,31.13513513513513,0.8895752895752894,1.7341685617185815e-07,7.283507959218042e-06,0.05,True
read-owner-no-visits,cpu_energy,J,2,31.13513513513513,0.8895752895752894,1.7341685617185815e-07,7.283507959218042e-06,0.05,True
read-owner-no-visits,memory_energy,J,2,23.64564564564563,0.6755898755898752,7.3352224265860455e-06,0.00016871011581147903,0.05,True
read-owner-populated,execution_time,ms,2,28.756756756756744,0.8216216216216212,5.695732855151473e-07,2.2213358135090745e-05,0.05,True
read-owner-populated,cpu_energy,J,2,28.938438438438453,0.8268125268125273,5.201132715340612e-07,2.080453086136245e-05,0.05,True
read-owner-populated,memory_energy,J,2,24.013513513513516,0.6861003861003862,6.1028373428460135e-06,0.00015867377091399634,0.05,True
read-pet-populated,execution_time,ms,2,28.060060060060067,0.8017160017160019,8.069290990024423e-07,2.9856376663090363e-05,0.05,True
read-pet-populated,cpu_energy,J,2,25.29729729729729,0.7227799227799226,3.211897581331243e-06,9.691381581210555e-05,0.05,True
read-pet-populated,memory_energy,J,2,28.756756756756744,0.8216216216216212,5.695732855151473e-07,2.2213358135090745e-05,0.05,True
update-owner-no-pets,execution_time,ms,2,15.761261261261282,0.4503217503217509,0.00037799460662638637,0.0022679676397583184,0.05,True
update-owner-no-pets,cpu_energy,J,2,25.253753753753756,0.7215358215358216,3.2825930729718835e-06,9.691381581210555e-05,0.05,True
update-owner-no-pets,memory_energy,J,2,21.5,0.6142857142857143,2.144540831658915e-05,0.00027879030811565897,0.05,True
update-owner-no-visits,execution_time,ms,2,23.42342342342343,0.6692406692406694,8.197250935172775e-06,0.00017008686412005487,0.05,True
update-owner-no-visits,cpu_energy,J,2,23.193693693693717,0.6626769626769633,9.195035428965354e-06,0.00017008686412005487,0.05,True
update-owner-no-visits,memory_energy,J,2,23.447447447447445,0.6699270699270699,8.099374481907376e-06,0.00017008686412005487,0.05,True
update-owner-populated,execution_time,ms,2,22.36636636636638,0.6390390390390394,1.3906096968325905e-05,0.00019468535755656267,0.05,True
update-owner-populated,cpu_energy,J,2,17.05555555555557,0.48730158730158774,0.0001978942466513122,0.0015831539732104976,0.05,True
update-owner-populated,memory_energy,J,2,23.83783783783784,0.6810810810810811,6.663145291397059e-06,0.00015991548699352944,0.05,True
update-pet-populated,execution_time,ms,2,20.388888888888886,0.5825396825396825,3.737739513435213e-05,0.00044852874161222553,0.05,True
update-pet-populated,cpu_energy,J,2,27.72972972972974,0.7922779922779926,9.51843825111835e-07,3.331453387891423e-05,0.05,True
update-pet-populated,memory_energy,J,2,25.977477477477464,0.7422136422136418,2.285927429459707e-06,7.314967774271063e-05,0.05,True

data/results/reference/intel/report.md

### Execution time (ms)

Kruskal-Wallis: H(2) = 19.875, epsilon² = 0.568, p = 4.832e-05, Holm-adjusted p = 4.832e-04 -> significant difference between ORMs.

### CPU energy consumption (J)

Kruskal-Wallis: H(2) = 9.866, epsilon² = 0.282, p = 0.0072, Holm-adjusted p = 0.0216 -> significant difference between ORMs.

### Memory energy consumption (J)

Kruskal-Wallis: H(2) = 10.599, epsilon² = 0.303, p = 0.0050, Holm-adjusted p = 0.0200 -> significant difference between ORMs.

### Execution time (ms)

Kruskal-Wallis: H(2) = 7.429, epsilon² = 0.212, p = 0.0244, Holm-adjusted p = 0.0487 -> significant difference between ORMs.

### CPU energy consumption (J)

Kruskal-Wallis: H(2) = 13.389, epsilon² = 0.383, p = 0.0012, Holm-adjusted p = 0.0062 -> significant difference between ORMs.

### Memory energy consumption (J)

Kruskal-Wallis: H(2) = 16.601, epsilon² = 0.474, p = 2.484e-04, Holm-adjusted p = 0.0017 -> significant difference between ORMs.

### Execution time (ms)

Kruskal-Wallis: H(2) = 15.761, epsilon² = 0.450, p = 3.780e-04, Holm-adjusted p = 0.0023 -> significant difference between ORMs.

### CPU energy consumption (J)

Kruskal-Wallis: H(2) = 17.056, epsilon² = 0.487, p = 1.979e-04, Holm-adjusted p = 0.0016 -> significant difference between ORMs.